{"$schema":"https://json-schema.org/draft/2020-12/schema","$id":"https://mindclade.dev/schemas/training-dataset-manifest/v1","title":"TrainingDatasetManifest","type":"object","additionalProperties":false,"required":["schema_version","kind","metadata","spec","lineage","integrity"],"properties":{"schema_version":{"const":"mindclade.training-dataset-manifest/v1"},"kind":{"const":"TrainingDatasetManifest"},"metadata":{"$ref":"#/$defs/metadata"},"spec":{"type":"object","additionalProperties":false,"required":["dataset","train_split","validation_split","test_split","split_ids_unique","feature_readiness","use_classification"],"properties":{"dataset":{"$ref":"#/$defs/artifact_ref"},"train_split":{"$ref":"#/$defs/artifact_ref"},"validation_split":{"$ref":"#/$defs/artifact_ref"},"test_split":{"$ref":"#/$defs/artifact_ref"},"split_ids_unique":{"const":true},"feature_readiness":{"$ref":"#/$defs/artifact_ref"},"use_classification":{"const":"NON_CLINICAL_RESEARCH"}}},"lineage":{"type":"array","minItems":2,"maxItems":64,"items":{"$ref":"#/$defs/artifact_ref"}},"integrity":{"$ref":"#/$defs/integrity"}},"$defs":{"digest":{"type":"string","pattern":"^sha256:[a-f0-9]{64}$"},"metadata":{"type":"object","additionalProperties":false,"required":["uid","created_at","producer","classification"],"properties":{"uid":{"type":"string","minLength":1,"maxLength":128},"created_at":{"type":"string","format":"date-time"},"producer":{"type":"string","minLength":1,"maxLength":128},"classification":{"enum":["PUBLIC","INTERNAL","RESTRICTED"]}}},"artifact_ref":{"type":"object","additionalProperties":false,"required":["uri","digest","media_type","schema_version"],"properties":{"uri":{"type":"string","pattern":"^artifacts/[A-Za-z0-9._~/-]+$"},"digest":{"$ref":"#/$defs/digest"},"media_type":{"type":"string","minLength":1,"maxLength":128},"schema_version":{"type":"string","minLength":1,"maxLength":128}}},"integrity":{"type":"object","additionalProperties":false,"required":["payload_digest"],"properties":{"payload_digest":{"$ref":"#/$defs/digest"},"evidence":{"type":"array","maxItems":32,"items":{"$ref":"#/$defs/artifact_ref"}}}}}}
