{"schema_version":"mindclade.training-dataset-manifest/v1","kind":"TrainingDatasetManifest","metadata":{"uid":"training-data-001","created_at":"2026-08-31T12:00:00Z","producer":"training-platform","classification":"INTERNAL"},"spec":{"dataset":{"uri":"artifacts/datasets/001","digest":"sha256:aaaaaaaaaaaaaaaaaaaaaaaaaaaaaaaaaaaaaaaaaaaaaaaaaaaaaaaaaaaaaaaa","media_type":"application/schema+json","schema_version":"mindclade.dataset-manifest/v1"},"train_split":{"uri":"artifacts/splits/train","digest":"sha256:bbbbbbbbbbbbbbbbbbbbbbbbbbbbbbbbbbbbbbbbbbbbbbbbbbbbbbbbbbbbbbbb","media_type":"application/vnd.apache.parquet","schema_version":"mindclade.dataset-split/v1"},"validation_split":{"uri":"artifacts/splits/validation","digest":"sha256:cccccccccccccccccccccccccccccccccccccccccccccccccccccccccccccccc","media_type":"application/vnd.apache.parquet","schema_version":"mindclade.dataset-split/v1"},"test_split":{"uri":"artifacts/splits/test","digest":"sha256:dddddddddddddddddddddddddddddddddddddddddddddddddddddddddddddddd","media_type":"application/vnd.apache.parquet","schema_version":"mindclade.dataset-split/v1"},"split_ids_unique":true,"feature_readiness":{"uri":"artifacts/readiness/001","digest":"sha256:eeeeeeeeeeeeeeeeeeeeeeeeeeeeeeeeeeeeeeeeeeeeeeeeeeeeeeeeeeeeeeee","media_type":"application/schema+json","schema_version":"mindclade.feature-readiness-receipt/v1"},"use_classification":"NON_CLINICAL_RESEARCH"},"lineage":[{"uri":"artifacts/datasets/001","digest":"sha256:aaaaaaaaaaaaaaaaaaaaaaaaaaaaaaaaaaaaaaaaaaaaaaaaaaaaaaaaaaaaaaaa","media_type":"application/schema+json","schema_version":"mindclade.dataset-manifest/v1"},{"uri":"artifacts/readiness/001","digest":"sha256:eeeeeeeeeeeeeeeeeeeeeeeeeeeeeeeeeeeeeeeeeeeeeeeeeeeeeeeeeeeeeeee","media_type":"application/schema+json","schema_version":"mindclade.feature-readiness-receipt/v1"}],"integrity":{"payload_digest":"sha256:ffffffffffffffffffffffffffffffffffffffffffffffffffffffffffffffff","evidence":[]}}
